[
  {
    "resume_id": "resume_001",
    "title": "Analytics Specialist",
    "summary": "Professional focused on analytics, building practical software and data solutions.",
    "skills": [
      "sql",
      "reporting",
      "tableau",
      "excel",
      "data analysis"
    ],
    "experience": [
      "2 years of professional experience",
      "Worked on analytics projects"
    ]
  },
  {
    "resume_id": "resume_002",
    "title": "Analytics Specialist",
    "summary": "Professional focused on analytics, building practical software and data solutions.",
    "skills": [
      "sql",
      "data analysis",
      "statistics",
      "reporting",
      "tableau"
    ],
    "experience": [
      "4 years of professional experience",
      "Worked on analytics projects"
    ]
  },
  {
    "resume_id": "resume_003",
    "title": "Data Engineering Specialist",
    "summary": "Professional focused on data engineering, building practical software and data solutions.",
    "skills": [
      "python",
      "postgresql",
      "sql",
      "etl",
      "airflow"
    ],
    "experience": [
      "5 years of professional experience",
      "Worked on data engineering projects"
    ]
  },
  {
    "resume_id": "resume_004",
    "title": "Data Engineering Specialist",
    "summary": "Professional focused on data engineering, building practical software and data solutions.",
    "skills": [
      "etl",
      "sql",
      "postgresql",
      "spark",
      "python"
    ],
    "experience": [
      "4 years of professional experience",
      "Worked on data engineering projects"
    ]
  },
  {
    "resume_id": "resume_005",
    "title": "Cloud Specialist",
    "summary": "Professional focused on cloud, building practical software and data solutions.",
    "skills": [
      "kubernetes",
      "aws",
      "docker",
      "terraform",
      "ci cd"
    ],
    "experience": [
      "3 years of professional experience",
      "Worked on cloud projects"
    ]
  },
  {
    "resume_id": "resume_006",
    "title": "Machine Learning Specialist",
    "summary": "Professional focused on machine learning, building practical software and data solutions.",
    "skills": [
      "scikit-learn",
      "pytorch",
      "python",
      "machine learning",
      "mlops"
    ],
    "experience": [
      "1 years of professional experience",
      "Worked on machine learning projects"
    ]
  },
  {
    "resume_id": "resume_007",
    "title": "Frontend Specialist",
    "summary": "Professional focused on frontend, building practical software and data solutions.",
    "skills": [
      "nextjs",
      "typescript",
      "css",
      "frontend",
      "react"
    ],
    "experience": [
      "6 years of professional experience",
      "Worked on frontend projects"
    ]
  },
  {
    "resume_id": "resume_008",
    "title": "Backend Specialist",
    "summary": "Professional focused on backend, building practical software and data solutions.",
    "skills": [
      "postgresql",
      "python",
      "rest api",
      "microservices",
      "django"
    ],
    "experience": [
      "3 years of professional experience",
      "Worked on backend projects"
    ]
  },
  {
    "resume_id": "resume_009",
    "title": "Analytics Specialist",
    "summary": "Professional focused on analytics, building practical software and data solutions.",
    "skills": [
      "statistics",
      "tableau",
      "reporting",
      "excel",
      "data analysis"
    ],
    "experience": [
      "1 years of professional experience",
      "Worked on analytics projects"
    ]
  },
  {
    "resume_id": "resume_010",
    "title": "Data Engineering Specialist",
    "summary": "Professional focused on data engineering, building practical software and data solutions.",
    "skills": [
      "data pipelines",
      "sql",
      "airflow",
      "python",
      "spark"
    ],
    "experience": [
      "7 years of professional experience",
      "Worked on data engineering projects"
    ]
  },
  {
    "resume_id": "resume_011",
    "title": "Data Engineering Specialist",
    "summary": "Professional focused on data engineering, building practical software and data solutions.",
    "skills": [
      "spark",
      "airflow",
      "postgresql",
      "data pipelines",
      "python"
    ],
    "experience": [
      "3 years of professional experience",
      "Worked on data engineering projects"
    ]
  },
  {
    "resume_id": "resume_012",
    "title": "Frontend Specialist",
    "summary": "Professional focused on frontend, building practical software and data solutions.",
    "skills": [
      "javascript",
      "frontend",
      "typescript",
      "react",
      "css"
    ],
    "experience": [
      "6 years of professional experience",
      "Worked on frontend projects"
    ]
  },
  {
    "resume_id": "resume_013",
    "title": "Machine Learning Specialist",
    "summary": "Professional focused on machine learning, building practical software and data solutions.",
    "skills": [
      "machine learning",
      "model training",
      "scikit-learn",
      "mlops",
      "tensorflow"
    ],
    "experience": [
      "4 years of professional experience",
      "Worked on machine learning projects"
    ]
  },
  {
    "resume_id": "resume_014",
    "title": "Frontend Specialist",
    "summary": "Professional focused on frontend, building practical software and data solutions.",
    "skills": [
      "frontend",
      "nextjs",
      "css",
      "javascript",
      "typescript"
    ],
    "experience": [
      "3 years of professional experience",
      "Worked on frontend projects"
    ]
  },
  {
    "resume_id": "resume_015",
    "title": "Data Engineering Specialist",
    "summary": "Professional focused on data engineering, building practical software and data solutions.",
    "skills": [
      "sql",
      "python",
      "airflow",
      "spark",
      "postgresql"
    ],
    "experience": [
      "1 years of professional experience",
      "Worked on data engineering projects"
    ]
  },
  {
    "resume_id": "resume_016",
    "title": "Machine Learning Specialist",
    "summary": "Professional focused on machine learning, building practical software and data solutions.",
    "skills": [
      "machine learning",
      "model training",
      "pytorch",
      "scikit-learn",
      "mlops"
    ],
    "experience": [
      "4 years of professional experience",
      "Worked on machine learning projects"
    ]
  },
  {
    "resume_id": "resume_017",
    "title": "Backend Specialist",
    "summary": "Professional focused on backend, building practical software and data solutions.",
    "skills": [
      "microservices",
      "rest api",
      "fastapi",
      "django",
      "python"
    ],
    "experience": [
      "2 years of professional experience",
      "Worked on backend projects"
    ]
  },
  {
    "resume_id": "resume_018",
    "title": "Analytics Specialist",
    "summary": "Professional focused on analytics, building practical software and data solutions.",
    "skills": [
      "statistics",
      "reporting",
      "tableau",
      "power bi",
      "data analysis"
    ],
    "experience": [
      "4 years of professional experience",
      "Worked on analytics projects"
    ]
  },
  {
    "resume_id": "resume_019",
    "title": "Frontend Specialist",
    "summary": "Professional focused on frontend, building practical software and data solutions.",
    "skills": [
      "javascript",
      "nextjs",
      "css",
      "html",
      "react"
    ],
    "experience": [
      "7 years of professional experience",
      "Worked on frontend projects"
    ]
  },
  {
    "resume_id": "resume_020",
    "title": "Data Engineering Specialist",
    "summary": "Professional focused on data engineering, building practical software and data solutions.",
    "skills": [
      "postgresql",
      "python",
      "sql",
      "etl",
      "airflow"
    ],
    "experience": [
      "4 years of professional experience",
      "Worked on data engineering projects"
    ]
  },
  {
    "resume_id": "resume_021",
    "title": "Cloud Specialist",
    "summary": "Professional focused on cloud, building practical software and data solutions.",
    "skills": [
      "aws",
      "terraform",
      "cloud",
      "ci cd",
      "kubernetes"
    ],
    "experience": [
      "3 years of professional experience",
      "Worked on cloud projects"
    ]
  },
  {
    "resume_id": "resume_022",
    "title": "Cloud Specialist",
    "summary": "Professional focused on cloud, building practical software and data solutions.",
    "skills": [
      "linux",
      "aws",
      "cloud",
      "kubernetes",
      "terraform"
    ],
    "experience": [
      "3 years of professional experience",
      "Worked on cloud projects"
    ]
  },
  {
    "resume_id": "resume_023",
    "title": "Data Engineering Specialist",
    "summary": "Professional focused on data engineering, building practical software and data solutions.",
    "skills": [
      "airflow",
      "spark",
      "sql",
      "data pipelines",
      "python"
    ],
    "experience": [
      "6 years of professional experience",
      "Worked on data engineering projects"
    ]
  },
  {
    "resume_id": "resume_024",
    "title": "Analytics Specialist",
    "summary": "Professional focused on analytics, building practical software and data solutions.",
    "skills": [
      "tableau",
      "statistics",
      "excel",
      "sql",
      "reporting"
    ],
    "experience": [
      "3 years of professional experience",
      "Worked on analytics projects"
    ]
  },
  {
    "resume_id": "resume_025",
    "title": "Analytics Specialist",
    "summary": "Professional focused on analytics, building practical software and data solutions.",
    "skills": [
      "statistics",
      "reporting",
      "excel",
      "data analysis",
      "power bi"
    ],
    "experience": [
      "7 years of professional experience",